Hand,Skat,Won,Points,Moves,DurationMs,StartPlayer
"C8 C9 CA S9 SK H8 D7 D8 DT DJ","H9 DK",false,1,"S7:100, SQ:100, S9:0, C7:100, C8:0, CJ:95, D9:100, DQ:100, DJ:3, HQ:98, H8:3, HK:85, CT:88, CK:93, C9:5, S8:90, SK:8, ST:100",17434,Left
"C9 CQ CK S7 H8 HJ HQ HK D7 DJ","S8 SJ",false,1,"C8:98, C7:100, C9:0",4691,Left
"C8 C9 CQ S7 S8 ST H8 HJ D9 DA","SK DQ",false,1,"H7:100, H8:0, HA:100, CT:98, CA:100, CQ:3, C7:100, C8:0, CK:85, HT:95, H9:98, HJ:0",12673,Right
"C7 CJ CK S8 SJ H8 H9 HT HQ DJ","CA D9",false,1,"C7:0, C8:100, CQ:100, H7:100, H8:0, HJ:100, D7:95, DT:98, DJ:0",9020,Declarer
"C8 CQ S8 SQ SA H7 H9 HJ HQ HA","D7 D8",false,1,"H8:98, H7:0, SK:100, HT:52, H9:0, DJ:100, HK:63, HQ:3, CJ:95, S9:55, S8:5, S7:98, CK:50, CQ:8, CT:93, ST:40, SQ:0, C7:100",21887,Right
"CT CA S9 ST H8 H9 HT HK DJ DK","CQ CK",false,1,"H8:0, HQ:100, HA:100, C7:100, CT:0, C8:100",6221,Declarer
"C9 CT CJ CA S8 HT HQ D7 D8 DA","H8 HA",false,1,"H7:100, HJ:100, HT:0, ST:90, S8:0, SK:100, C7:100, CQ:85, CJ:0, H9:93, HQ:5, S7:100",13586,Left
"CT CA SJ H9 HT D7 D9 DT DK DA","CJ S7",false,1,"D7:0, DJ:100, DQ:98, C7:100, CT:0, CK:95, D8:100, SA:100, D9:0",10109,Declarer
"C9 CJ S8 S9 SQ SK H9 HQ HA DQ","SJ D9",false,1,"S8:0, SA:100, DK:98, S7:100, CK:100, S9:0",7971,Declarer
"C8 CT CQ S9 SQ SA H7 H8 HQ HA","CJ D9",false,1,"H7:0, HJ:100, HK:100, S7:100, S9:0, SK:98, HT:95, H9:100, H8:0, DT:90, D7:100, SA:0, DJ:90, CA:0, HA:100, C7:80, CK:85, CQ:0, S8:93, SQ:0, D8:100",21332,Declarer
"C7 C8 CQ CK S8 SJ SK HJ HA DQ","ST H8",false,1,"H7:100, HJ:0, HK:100, D7:100, D8:90, DQ:0",6778,Right
"CQ CA SA H7 HT HJ HQ HA D8 D9","S7 S9",false,1,"H7:0, DA:100, HK:100, H8:100, HT:0, C7:100",6188,Declarer
"C7 C9 CK S7 S9 ST HA D7 DJ DQ","H9 HJ",false,1,"S8:100, S7:0, SA:100, D8:100, DK:95, DQ:0, H8:85, HA:0, H7:100",10820,Right
"CA S7 SQ SK SA HQ D8 D9 DT DQ","H7 DK",false,1,"S8:98, S7:0, DA:100, C7:100, CA:0, C8:100",7784,Right
"C8 CK CA SQ HT HK D9 DJ DQ DA","CJ H7",false,1,"C8:0, CQ:98, CT:98, D7:100, DT:100, D9:0, C9:100, CK:0, C7:100",10720,Declarer
"C7 CQ CA S7 S8 SJ SK HJ HA DK","C9 HQ",false,1,"H7:100, HT:100, HJ:0",3884,Left
"C9 CQ CA S9 ST SQ SK H8 HT D7","HA D8",false,1,"H7:100, H8:3, H9:100, C7:100, CJ:95, C9:3, S7:98, S9:0, SA:98, D9:93, DQ:95, D7:3, CT:93, CQ:0, C8:100",14496,Right
"CT CJ SQ SK H7 HT HQ D8 D9 DT","C8 H8",false,1,"C7:100, CT:0, C9:100",3202,Right
"C7 CT S7 SQ SA H7 HT HK D8 DK","SK HA",false,1,"C8:100, CA:100, CT:0, H8:100, H7:0, HQ:100, S8:98, SJ:98, S7:0, D7:98, D8:0, DT:100, S9:98, DA:100, SQ:0",15388,Left
"CQ S8 S9 SK SA HT HJ D9 DT DQ","HQ HK",false,1,"H8:100, HT:0, HA:100, S7:100, SQ:98, S9:0, C7:98, CQ:0, CT:100",8513,Right
"C7 C9 CJ CK CA S8 SJ SQ HA D8","S9 SK",false,1,"D7:100, DA:100, D8:0, S7:100, S8:0, H7:100",7413,Left
"C8 CJ S9 ST SJ SK H9 HJ HK DK","HQ D7",false,1,"H7:100, H9:0, HT:95, S8:100, SA:100, SK:0, C7:100, C8:0, CA:93, D9:90, DA:98, DK:3, D8:100, CJ:13, DQ:58, C9:65, CT:100, HK:43, S7:100, S9:25, DT:100",22979,Right
"C9 CQ CA SJ SK HT HJ HQ DT DA","C8 SA",false,1,"C9:0, CK:100, CT:100, S7:98, S8:100, SJ:0",6395,Declarer
"C7 C9 CQ ST SJ SA HT D8 DJ DA","SQ HQ",false,1,"H7:100, HA:100, HT:0, D7:98, D8:0, DK:95, CT:93, C8:100, C9:0, D9:95, CA:100, DJ:0",14510,Left
"C7 C9 CJ CK CA S8 SK H9 D8 DK","HQ DQ",true,0,"C7:0, CQ:100, C8:100, D7:100, DJ:100, D8:0, S7:100, S8:0, SJ:100, HT:100, HK:98, H9:3, H7:93, DK:20, HA:90, DT:95, D9:90, SK:100, CT:93, SA:23, C9:100, S9:0, SQ:0, CA:100, H8:0, CK:100, HJ:0, DA:0, ST:0, CJ:100",32795,Declarer
"C8 CQ CK CA ST SJ SA H9 HJ DK","SK D9",false,1,"C7:98, DA:100, C8:0",4407,Left
"C9 S8 S9 ST SQ SA HA D8 DJ DK","S7 SJ",false,1,"H8:100, HA:0, H7:100",3298,Right
"C8 CJ CQ CK SK SA HA D7 D8 DQ","CT HT",false,1,"C7:98, C9:100, C8:0, S7:98, SK:0, ST:100",6122,Left
"C7 C8 C9 CK S8 ST SQ HJ D9 DA","S9 SJ",false,1,"S7:100, SA:100, SQ:0, D7:100, D9:0, D8:100",5492,Left
"C7 CT CJ CQ S9 SJ SK HT HK DQ","SQ HQ",false,1,"H7:100, HJ:100, HT:0, S7:100, S9:0, SA:100, D8:100, DT:98, DQ:0",9285,Left
"C7 CQ CA S9 ST SA D9 DJ DQ DA","SJ HJ",false,1,"D8:100, D9:0, DK:100, H7:100, HK:100, DA:0, DT:98, DJ:0, D7:100",9901,Right
"CT CK S7 S8 S9 H7 HJ HA D7 D8","SK HQ",false,1,"D9:100, DA:100, D8:0, C8:93, CT:0, CA:100, H9:100, HT:95, H7:0, DQ:95, D7:0, DJ:95, SJ:93, S9:5, SQ:90, C7:83, CQ:90, CK:0",20486,Left
"S7 SA H7 HT HJ HA D7 DJ DQ DA","CA S9",true,0,"H8:100, H7:0, HK:100, S8:100, SQ:93, S7:0, C9:100, SA:8, CQ:90, DT:73, D9:100, D7:15, SK:63, SJ:95, HA:20, H9:100, HQ:100, HJ:50, D8:100, DJ:45, DK:0, C7:0, CK:0, DA:100, ST:0, DQ:100, CT:0, CJ:0, HT:100, C8:0",31208,Right
"C7 C8 CT S8 SJ H9 HT HA DQ DA","S7 DT",false,1,"D7:100, DJ:100, DQ:0",3812,Left
"C9 CJ S8 ST SQ SK H8 HK D7 DQ","C8 HJ",false,1,"H7:100, H8:0, HA:100, D8:100, DK:100, DQ:0, C7:100, C9:0, CA:98, S9:98, SA:95, SK:0, D9:88, D7:0, DA:90, CT:85, CK:85, CJ:0, H9:73, HK:0, HQ:100",24595,Right
"C7 CT CQ S7 S8 HA D7 DT DJ DA","SQ H7",false,1,"S7:0, SA:100, SK:100, C8:100, CJ:100, CT:0, H8:98, HA:0, H9:100",10284,Declarer
"C7 CK S8 ST SK H9 HT D7 DT DK","D8 D9",false,1,"D7:0, DQ:95, DA:100, SJ:100, ST:0, SA:100, HJ:95, HA:93, HT:0, H7:100, H9:0, HK:88, CJ:85, CT:90, C7:0, CQ:83, C9:85, CK:0",20130,Declarer
"C8 CT S9 ST SQ SK HK HA D8 DA","HJ D9",false,1,"C7:100, C8:0, CJ:98, S7:98, SA:100, SK:0, D7:100, D8:0, DK:98, S8:95, SJ:88, ST:0, DT:90, DA:0, DQ:100",17871,Right
"C7 CT CQ S7 SJ SA H8 HJ DK DA","SK D8",false,1,"C7:0, CK:100, CA:100, H7:100, H8:0, HA:93, ST:98, SQ:100, SJ:0, C8:100, CT:0, C9:100",13595,Declarer
"CJ CK S8 ST SQ SK H7 H8 D7 DJ","CT D9",false,1,"D7:0, DA:98, DQ:98, DK:100, DT:90, DJ:0, C9:93, CA:100, CK:3, C8:95, CJ:3, C7:100",13795,Declarer
"C9 CK S8 H7 HT HA D7 D9 DT DK","SQ HK",false,1,"S7:100, S8:0, SA:100, H8:98, HJ:100, HT:3, C7:98, C9:0, CA:95, CJ:95, CT:90, CK:0",15521,Right
"C7 CT CK CA SQ SA HT HK HA D8","C9 H8",false,1,"C7:0, CJ:98, CQ:100, C8:100, CT:0, H7:100",6975,Declarer
"CK CA S8 SQ SK H8 HQ D8 D9 DQ","C8 ST",false,1,"D7:100, DA:100, DQ:0, S9:98, S8:0, SA:100, C7:98, CQ:93, CK:0",9621,Left
"C8 CJ CQ S7 SK H9 HK D7 DJ DQ","D8 DK",false,1,"C7:100, C8:0, CK:100, H8:100, H7:98, H9:0",6502,Right
"C8 CJ CQ CK CA S7 S8 ST SJ DJ","DT DK",false,1,"S7:0, SA:100, SQ:100, H9:98, H8:100, DJ:5, C7:93, CT:100, C8:3, DQ:88, CA:10, D7:100, S9:25, S8:25, SK:100, C9:100, DA:100, CJ:0",19383,Declarer
"C8 CA S7 S8 ST H9 HT HJ DJ DA","CK DK",false,1,"H8:98, H9:0, H7:100",4421,Right
"C7 CQ ST SJ SQ H8 HQ D7 D8 DK","CT S8",false,1,"C7:0, CA:100, CK:95, S7:100, SA:100, SQ:0, DQ:95, D8:0, DJ:100, H7:100, H8:0, HK:98, C8:93, C9:75, CQ:0",15975,Declarer
"C7 C9 CT CJ S7 S8 ST H7 HQ D9","S9 HT",false,1,"S7:18, SK:100, SA:93, D8:90, D9:8, D7:100",15009,Declarer
"C8 CQ CK CA SQ H7 H8 HJ D7 DK","CT HQ",false,1,"C7:100, CJ:100, C8:0, S7:100, SQ:0, S8:100",6906,Left
"C9 CJ CQ H8 HT HQ D7 D8 D9 DQ","SQ HK",false,1,"D7:0, DJ:100, DA:95, HJ:100, HT:3, HA:100, C7:100, CA:93, CQ:8, S7:95, HQ:18, ST:100, H9:98, CK:73, H8:35, H7:100, DK:85, CJ:70, C8:100, SA:90, C9:0",22393,Declarer
"CT CQ S9 SQ SA H9 HJ HQ D7 DQ","SK HA",false,1,"H7:100, HK:100, HQ:0, S7:100, S9:0, ST:100, C8:100, C7:98, CT:0",8201,Left
"C9 CJ CK H8 H9 HT HJ HQ DJ DA","S8 ST",false,1,"C7:100, C9:0, CQ:100, D7:100, D8:90, DJ:0",6303,Right
"C7 CT S9 HT HK HA D7 D9 DQ DA","SJ D8",false,1,"H7:100, HT:0, H8:100",3188,Right
"C7 CA S9 SQ HT HJ HQ D8 D9 DT","CT S7",false,1,"H8:93, HT:0, H7:100",7413,Right
"C8 CJ S7 ST H7 HT HA D8 DJ DQ","SA HQ",false,1,"D7:100, D8:0, DA:100, S8:100, SQ:100, ST:3, H8:100, H7:0, HJ:98, S9:98, CA:100, S7:8, SJ:100, CK:100, CJ:8, D9:88, DK:100, DQ:8, DT:90, DJ:0, C9:100",21202,Right
"CT CJ CK S8 ST H8 HK HA D8 DJ","SK H9",false,1,"C9:98, CT:0, C7:100",4004,Right
"C7 CT CQ S7 ST SQ H8 HQ HK DK","CK D8",false,1,"C8:98, C7:0, CA:100, H7:100, HA:100, HK:0, S8:95, S7:0, SA:100, H9:100, HT:88, H8:0, SJ:95, ST:0, SK:98, S9:93, DQ:75, SQ:0",19769,Right
"C8 S7 S9 ST SK SA H8 HQ DT DQ","C9 D7",false,1,"H9:98, HJ:100, H8:3, H7:100, HQ:5, HT:100",8698,Left
"S7 S8 ST SA HJ HQ HK D8 DQ DA","C7 DJ",false,1,"C8:100, SA:0, CK:100, H7:100, HT:98, HJ:0",7513,Right
"C8 CT S7 SK HA D8 DT DQ DK DA","CQ CA",false,1,"S8:93, S7:0, SQ:100, C7:98, CK:80, CT:0, H9:93, HA:0, H7:100",13589,Right
"C7 CK S7 H7 HT HK HA D7 D8 DJ","SK DK",false,1,"H8:98, HJ:100, HT:3, S8:98, S7:3, SA:95, C8:98, CQ:90, C7:8, DQ:95, DJ:13, DT:93, S9:95, CK:78, SQ:90, H9:80, DA:80, H7:0, HQ:100, CA:80, HK:0",22608,Left
"C8 C9 CT CK SQ HQ HK HA DT DA","CA S9",false,1,"C7:100, DQ:100, C8:0",2904,Left
"C9 CT CJ CA S7 ST SQ D8 DJ DQ","CQ D9",false,1,"H8:98, HK:100, CA:0, S8:100, S7:0, SA:98, DK:90, HQ:98, DQ:0, D7:100, CK:100, D8:0",15790,Left
"C7 CT S8 S9 H8 HQ HA D9 DJ DA","SK H7",false,1,"C7:0, CA:98, C9:98, S7:93, SJ:100, S9:0, D7:95, D9:0, DK:98, HT:93, HJ:95, H8:3, ST:93, S8:0, SA:85, C8:65, DT:93, CT:0",22193,Declarer
"C9 CK S7 H7 HT HK HA D7 DJ DA","S9 ST",false,1,"H8:98, HQ:100, HT:0, D9:98, D7:3, DQ:100, C7:100, C8:100, C9:0",9527,Left
"C7 CT CQ S8 S9 SA HQ D7 D8 DJ","SK DQ",true,0,"H8:100, HQ:0, HA:100, S7:100, SQ:93, S9:5, H9:95, SA:43, HK:100, C8:100, CJ:85, CT:100, DK:80, DJ:100, DT:78, DA:85, D8:100, D9:68, CK:73, CQ:100, CA:0, H7:0, SJ:0, S8:100, HT:0, ST:0, C7:100, HJ:0, C9:0, D7:100",32493,Right
"C7 C9 CJ CQ S9 ST SK H9 HJ DK","SJ DJ",false,1,"D7:100, DK:0, D9:100",3883,Right
"C8 CK S7 ST H8 H9 HT HQ DQ DA","CJ SQ",false,1,"S7:0, SK:100, SA:100, D8:100, DQ:0, D7:100",6094,Declarer
"CK CA S7 S9 SK SA HT HK D8 DA","C7 H9",false,1,"S7:0, SQ:98, ST:100, D7:100, D9:100, D8:0, C8:100, CK:0, C9:100",8022,Declarer
"C7 C9 CT S7 ST SQ HJ HQ D8 D9","S8 DQ",false,1,"C7:0, CA:100, CK:95, H7:100, HT:88, HJ:0",7091,Declarer
"C7 CT CJ CQ H7 HT DJ DQ DK DA","C9 D8",false,1,"H7:0, H9:100, HA:100, D7:100, DJ:0, D9:100",5610,Declarer
"C7 C8 CK CA ST SJ SK H8 H9 D7","S7 HJ",false,1,"D7:3, DA:95, DQ:100, S9:90, S8:100, ST:0",6593,Declarer
"CJ CQ CA S7 SJ H7 H8 D9 DT DK","C7 ST",false,1,"S8:95, S7:0, SA:100, D7:98, DQ:90, DT:0, H9:93, H8:0, HA:98, C8:95, CT:95, CJ:0",11406,Right
"C9 CK S7 ST SK H7 H8 H9 D9 DA","SJ HJ",false,1,"S8:93, SA:100, SK:0, C7:100, C9:0, C8:100",6484,Left
"C7 CT CA ST SK SA H9 HT DJ DQ","SQ H8",false,1,"D7:100, DA:100, DQ:0, S7:100, ST:0, S9:100",5088,Left
"CJ CQ CA S9 ST HK HA D7 DJ DA","S8 HJ",false,1,"D7:0, DK:100, DQ:100, C7:100, CK:100, CQ:0, H8:100, HK:0, H7:100",7321,Declarer
"C7 C8 C9 CK SK H9 HQ HK D7 D8","S8 H8",true,0,"S9:100, SA:100, SK:3, S7:100, HK:0, DQ:98, DJ:98, D8:5, DT:83, CQ:90, C9:3, CA:75, CT:65, DA:88, C8:10, HT:40, H7:83, H9:0, D9:43, DK:0, D7:100, ST:0, CK:100, HA:0, SJ:0, HQ:100, CJ:0, SQ:0, C7:100, HJ:0",27720,Left
"C8 CJ CQ CA SQ SA H7 HJ DJ DQ","ST HQ",false,1,"S8:100, SQ:0, SK:100, D7:100, D9:90, DJ:0",6077,Right
"CK S7 SA H7 H9 HQ HA D7 DT DK","CJ CQ",false,1,"D7:0, DA:95, DQ:100, ST:98, SQ:100, S7:0, C7:100, CK:0, C8:100",7779,Declarer
"C9 CK S8 SJ SK SA HQ D8 DT DA","C8 CQ",false,1,"D8:0, DK:100, DJ:98, C7:98, CA:98, CK:0, D7:98, DT:0, DQ:100, H7:95, HK:100, HQ:0, CT:100, C9:8, CJ:90, S9:78, SQ:90, SJ:18, ST:83, S8:40, HA:55, S7:100, SK:0, H8:100",18128,Declarer
"C7 C9 CJ S9 ST SJ SQ H8 HJ DJ","CA H7",false,1,"D7:98, DA:100, DJ:3, C8:100, C7:0, CT:95, S8:93, S7:100, S9:0",8787,Left
"S7 S9 ST SK SA H8 HJ D7 D8 DK","HQ HK",true,0,"C8:100, CA:100, HJ:52, H9:100, H8:63, HA:93, SQ:100, SJ:90, ST:75, H7:80, DJ:95, SA:100, D9:8, DT:30, D8:100, S8:20, S7:100, DA:0, C7:0, DK:100, CK:0, HT:0, CJ:0, SK:100, DQ:0, CT:0, D7:100, CQ:0, C9:0, S9:100",34698,Left
"C8 C9 CT CK S8 SK H7 HT HJ DT","S7 SA",false,1,"H7:0, HA:100, HK:100, C7:100, CA:100, CK:0, D7:100, DT:0, D8:100",7499,Declarer
"C8 S7 S8 SQ SA H8 H9 HK HA DA","CK DT",false,1,"S7:0, SK:100, ST:98, D7:100, D9:100, DA:0",4894,Declarer
"C7 C8 C9 S8 SQ SK H8 HT D9 DA","CT CJ",false,1,"S7:98, SJ:83, S8:0, H9:90, H8:0, HQ:98, H7:98, HA:63, HT:0, CQ:85, C9:0, SA:100, CK:70, C8:0, DJ:93, CA:75, C7:3, D8:88, DT:60, D9:0, DK:90, HJ:70, HK:0, DA:100, ST:0, SQ:0, S9:100",25996,Left
"C7 C9 CA SK SA H7 H8 D7 DT DK","HT D9",false,1,"SJ:95, SK:0, S7:100",5002,Right
"C7 CJ S8 SK HT HJ HQ D7 D8 DA","CA S9",false,1,"C9:95, CK:100, CJ:0, S7:98, S8:0, H7:100",9721,Left
"C7 C8 CT CA ST H7 HT HQ HK DA","DT DJ",false,1,"C7:0, CK:100, SA:95, D7:100, DK:95, DA:0",7382,Declarer
"C8 CQ CK S9 ST H9 HT HJ DK DA","SQ HK",false,1,"D7:100, DJ:98, DK:0",3088,Left
"C8 C9 S7 HJ HK D8 DT DJ DQ DK","CJ ST",false,1,"C7:100, CA:98, C9:0, H7:98, HJ:0, HT:100",6325,Left
"C7 C9 CK S8 S9 SQ H8 HT DQ DK","D9 DT",false,1,"DJ:93, DA:100, DK:0, S7:100, S8:0, SA:73, H9:93, HA:95, HT:0, C8:100, C7:0, CA:78, ST:80, CJ:93, S9:0, SJ:100, D8:75, SQ:0",17674,Left
"C8 C9 CK CA S9 SJ HK HA DK DA","SQ H8",false,1,"S7:100, S9:0, SA:100, C7:95, CQ:100, C9:0, D9:98, DK:0, D7:100",6816,Right
"C8 C9 CT CK S7 ST HJ HK D8 DK","CJ S9",false,1,"D7:100, D8:0, DA:98, H8:100, HA:100, HK:0, C7:100, C8:0, CA:98, H9:93, H7:95, HJ:0",9098,Right
"C7 C8 ST SJ SK H9 HK D8 DT DA","CK DQ",false,1,"D7:100, D9:100, D8:0, H7:100, H9:0, HA:100, C9:100, CJ:100, C8:0, S8:98, ST:0, S7:100",10398,Left
"CJ CQ SJ SQ HT D8 DJ DQ DK DA","CT DT",false,1,"H7:100, HT:0, HA:100, S7:100, SA:100, SQ:0, C7:100, CJ:0, C9:100",11990,Right
"C8 C9 CT CK CA SA H8 H9 HJ D8","S7 SK",false,1,"H7:100, H8:0, HK:98, D7:100, DQ:100, D8:0, C7:98, C8:0, CQ:98, S8:98, SJ:88, SA:0",13706,Right
"C8 S8 ST SK H8 H9 HJ HA D7 DQ","CA HT",false,1,"C7:100, C8:0, CT:100, H7:100, HQ:100, HJ:3, D8:98, D7:5, DA:100, DT:98, DK:80, DQ:40, S9:98, S8:35, SA:93, SJ:83, CK:80, ST:0, S7:100, CQ:70, SK:0",24092,Right
"CQ CK S8 S9 ST SJ SA HJ HK D8","CJ H8",false,1,"S8:0, SQ:100, SK:100, D7:100, D8:0, DA:100, C7:100, C9:100, CQ:0",8215,Declarer
"C8 S8 SJ H8 HJ HA D7 DT DJ DQ","HK D8",true,0,"S7:100, SA:95, SJ:8, D9:95, D7:0, DK:100, C9:100, C7:88, C8:5, CT:95, CA:65, HA:10, H9:60, H8:13, HT:90, SQ:78, SK:10, S8:30, ST:13, HJ:45, S9:60, HQ:20, DQ:70, H7:0, CQ:0, DJ:85, CK:0, CJ:0, DA:0, DT:100",32284,Left
"C9 CA S8 SK SA H9 HT HJ DJ DK","H8 DA",false,1,"D7:100, DJ:0, D9:100",2902,Right
"C8 CQ CA ST SJ SA H7 H8 HK DT","C7 D7",false,1,"H9:100, HA:95, HK:0, HQ:93, H8:0, HJ:95, D8:88, DT:0, DK:100, S7:100, S9:98, ST:0",13822,Left
"C7 CJ CQ CK S9 ST SJ HQ HA D7","C9 HJ",false,1,"D7:0, DA:100, DK:100, H7:100, HK:98, HQ:0, SQ:100, SJ:3, S8:95, D8:98, HA:13, DJ:83, CA:75, C8:58, CK:35, S7:85, DQ:100, S9:0",13286,Declarer
"C8 S7 S9 SJ SQ SA H7 HT DQ DK","SK D8",false,1,"H7:0, HK:100, HA:100, D7:100, DQ:0, DA:100, C9:100, CA:100, C8:0, S8:98, S7:3, DJ:88, ST:50, S9:3, CT:88, H8:30, HT:5, H9:100",14813,Declarer
"C9 CK S7 SA H8 HT HJ HA DT DQ","H9 HK",false,1,"D7:100, DT:0, DJ:100, H7:100, DA:100, H8:0",6722,Right
"CA S8 H8 HJ HQ HK HA D7 D8 DK","SA DJ",false,1,"H7:100, H8:0, C7:100",2105,Right
"CQ CA S7 S8 S9 SK H9 HT DJ DA","C8 CJ",false,1,"D8:100, D7:100, DJ:0",2978,Left
"C8 CQ CK S8 SJ SA H8 D9 DT DJ","HQ DK",false,1,"H7:100, HK:100, H8:0, C7:100, C8:0, CJ:98, D8:98, D7:98, D9:0",11894,Left
"C7 ST SJ SK SA H9 HQ DQ DK DA","H7 H8",false,1,"C7:0, CA:93, CQ:98, S9:98, SQ:98, SJ:0, D7:100, DQ:0, D8:100",9720,Declarer
"CJ S8 SQ H8 H9 HA D8 DT DQ DA","HK DK",false,1,"C7:100, CT:100, CJ:0",3105,Left
"C8 CT CK S7 S8 ST SA H9 D7 DT","S9 D9",false,1,"S7:8, SQ:100, SK:98, HT:100, H9:13, HK:98, D8:98, DQ:98, DT:18, C7:93, C8:30, H8:100",16577,Declarer
"CT CJ SJ SQ SK H7 HK D7 DT DQ","C8 C9",false,1,"C7:98, DA:100, CT:0",3295,Left
"C9 CT CK CA SJ SQ H7 HJ D9 DQ","SA H9",false,1,"H7:0, HK:95, HA:100, C7:100, C9:0, CJ:98, S8:100, S9:100, SJ:0",8823,Declarer
"C7 C8 C9 CT S8 SQ HJ HK DT DA","SA DK",false,1,"H8:100, HJ:0, HA:100, S7:100, SJ:95, S8:0, S9:95, SQ:0, SK:93, D7:100, DQ:95, DT:0, CJ:85, CT:0, CQ:88, D8:78, CA:100, DA:0",15985,Right
"CK S7 SQ SK H8 HQ HK D9 DT DQ","H9 D8",false,1,"ST:100, S7:0, S9:100, CJ:95, CK:0, C7:100",5894,Right
"C9 CT S8 ST SJ SQ SK H9 HT HQ","D7 DK",false,1,"S7:95, S9:100, S8:3, H7:100, H9:0, HA:90, DJ:98, DA:100, HQ:20, H8:98, HT:30, HK:35, SA:43, DT:98, SK:52, C8:52, C7:100, C9:0",16693,Left
"C7 C8 CA S7 SK SA H7 HT D7 D8","HK DA",false,1,"S7:0, SQ:100, ST:100, S8:98, HA:100, SK:0",5216,Declarer
"CT S7 SK H9 HK HA D7 D8 DT DA","CJ ST",false,1,"H7:100, HT:100, H9:0, S9:100, S7:0, SA:98, S8:98, SJ:98, SK:0",9088,Left
"C7 C9 CQ CK S7 SA HQ HA D7 DT","S8 D9",false,1,"S9:95, S7:0, SQ:100, H7:100, H9:95, HQ:0",8517,Right
"C7 CJ CA S7 S8 SK H8 HJ HA DQ","H9 DJ",false,1,"H7:100, HK:98, HJ:0, D8:98, DQ:0, D7:100",9082,Left
"CJ S8 S9 ST SJ SK HT D7 D9 DQ","SQ HJ",false,1,"H7:100, HT:0, HK:100, S7:100, HA:100, S8:0",7412,Right
"C7 C9 CK SA H7 H8 HT HJ D7 DA","H9 DQ",false,1,"S8:100, SA:0, S7:100",3498,Right
"C8 ST SQ SK SA HK D7 D9 DT DA","CQ HJ",false,1,"D7:0, DJ:100, DK:100, H7:100, HK:0, HA:100, D8:95, DQ:100, DT:0, C7:100, C8:0, CK:98, S8:85, S9:98, ST:0",14113,Declarer
"C8 C9 CQ S8 S9 SK H9 HK D7 DA","CT CK",false,1,"H7:100, HQ:100, H9:0, C7:100, C8:0, D9:100",5800,Left
"CJ CQ CK S7 S8 SJ SQ HQ DJ DQ","ST HA",false,1,"D9:100, DJ:0, D7:100",3369,Right
"C7 C8 CJ CQ S7 H8 H9 HT D7 DJ","SA HJ",true,0,"C9:98, C8:10, CA:100, H7:100, HK:88, HT:35, DT:88, D7:25, DQ:98, S8:98, SQ:80, S7:43, CT:88, C7:30, CK:95, D8:88, DA:70, DJ:100, ST:60, CQ:100, SK:55, D9:58, DK:0, CJ:100, SJ:0, H9:100, S9:0, HQ:35, H8:100, HA:0",29396,Right
"CT CQ SJ SQ SA HJ HQ D7 D8 DQ","CK ST",false,1,"D7:0, DA:100, DT:100, S7:100, S9:100, SJ:0",6227,Declarer
"C9 CT CQ S8 S9 H8 HQ HK HA D7","SA DT",false,1,"H7:100, H9:100, H8:0, S7:100, S8:0, SK:95, C7:98, CJ:100, CT:0, C8:98, C9:5, CA:93, DJ:88, D9:80, D7:3, HT:73, DA:95, HQ:0",16902,Left
"CT CK S8 S9 SK H8 H9 HA DK DA","HJ DT",false,1,"H7:100, H8:0, HK:98, C7:100, CA:100, CK:0, ST:100, S9:0, SA:98, D7:100, DQ:93, DK:0",15186,Right
"CA SJ SA H7 H9 HT HQ D8 DJ DA","ST HJ",false,1,"D7:100, DQ:98, DJ:0, S7:100, SJ:0, SQ:100, C7:100, CK:100, CA:0",10299,Left
"CK ST SJ SA H7 H8 H9 HA D8 DT","HJ DA",false,1,"H7:0, CA:100, HK:98, HT:100, H9:0, DQ:100, HQ:98, H8:0, SQ:90, SK:98, SJ:0, S9:95, C7:85, CK:0, CT:100",18692,Declarer
"C7 C8 CJ S9 ST SA D7 D9 DJ DQ","SJ DK",false,1,"S8:100, SK:95, ST:8, H9:98, SA:48, HK:95, D8:85, DA:93, DQ:48, DT:95, D9:63, CA:83, CQ:83, CJ:70, C9:60, CT:88, C8:80, SQ:58, S7:0, S9:58, H7:100",31009,Left
"CJ CQ CA S7 SA H7 HJ HQ HK DT","DJ DQ",false,1,"S7:0, SK:100, SQ:100, C8:100, CK:100, CQ:0, S9:100, SA:0, S8:100",10892,Declarer
"C9 CT CK S7 SQ SK H8 H9 D9 DA","HA DJ",false,1,"S7:0, SA:100, SJ:100, S8:98, ST:100, SQ:0",7602,Declarer
"CT S9 SJ H8 H9 HQ D8 DT DJ DA","SQ DQ",false,1,"D7:100, D8:0, DK:100, S7:100, SA:100, SJ:0, C8:98, CT:3, C7:100",8111,Right
"C8 CQ CK CA S7 S8 S9 D7 D9 DQ","ST HA",false,1,"C9:95, CJ:100, C8:0, C7:95, CQ:0, CT:100",4785,Left
"C7 C9 CT SA H7 H8 HK DT DQ DA","SJ HT",false,1,"D7:100, DK:100, DQ:0, D9:95, DT:0, D8:100",5599,Left
"C9 CQ CK CA S7 H7 HT HQ HK D9","S9 ST",false,1,"H7:0, HA:100, HJ:100, C7:100, CJ:100, C9:0, D7:98, D9:3, DA:98, H8:100, H9:95, HT:0",10312,Declarer
"C8 CK S7 SQ SK SA HT HJ D9 DA","C9 H8",false,1,"S7:0, ST:100, SJ:98, DT:98, D9:0, DQ:100, D7:98, DK:100, DA:0",8402,Declarer
"C7 CJ CQ CA SJ SQ SA HT DT DK","S8 HQ",false,1,"C7:0, CT:98, CK:100, H7:100, HT:0, HA:93, S9:95, ST:98, SJ:0",8773,Declarer
"C9 CQ S7 SJ SQ SA H9 HJ HK DQ","CT SK",false,1,"S7:0, ST:100, S9:98, D7:100, DA:100, DQ:0, H7:100, H9:0, HA:98, CK:93, CA:98, CQ:0, C8:95, C9:3, C7:100",14113,Declarer
"CT CJ CQ CK CA SJ H8 HA D9 DT","SK D7",false,1,"H8:0, HK:98, HJ:100, C7:100, DA:100, CT:0",6011,Declarer
"C8 CJ CK ST SJ SA HT D7 DQ DK","H8 H9",false,1,"D7:0, DA:100, DJ:100, H7:100, HK:98, HT:0, D8:100, DQ:0, D9:100",7997,Declarer
"C8 CQ S8 SK SA H7 H9 HK HA D8","CT SJ",false,1,"S7:100, ST:100, S8:0, D7:100, D8:0, DA:98, C7:95, C9:100, C8:0, H8:93, H7:0, HJ:93, HT:93, HQ:88, H9:0, CK:85, CQ:3, CJ:73, SQ:65, SK:0, D9:100",19308,Left
"CJ CQ CK SQ SK H7 HT HJ HA DT","H8 DJ",false,1,"H7:0, DA:95, HK:93, S9:100, SQ:0, S7:100",7770,Declarer
"CT CJ CA SJ H9 HJ HQ D9 DT DJ","HK D7",false,1,"D9:0, DA:100, DK:100, S8:98, SA:100, SJ:0, C7:100, CT:0, C8:100",8010,Declarer
"S7 SJ SA H7 H9 HQ HA D7 DT DJ","CK D9",false,1,"HJ:98, H9:0, HK:100, H8:93, DA:95, H7:0, D8:100, DK:93, DJ:0, C7:100, SA:0, CQ:100, S8:100, SK:13, SJ:10, C8:13, HA:5, CT:100, HT:100, DQ:78, HQ:0",18206,Right
"C9 S8 ST H9 HA D8 DT DQ DK DA","CT CA",false,1,"C8:100, C7:100, C9:0",3089,Left
"C8 C9 CQ S7 SQ SA H8 HA D8 DJ","SK D9",false,1,"S7:0, S8:98, SJ:95, H9:98, H8:0, HQ:98, H7:100, HK:93, HA:0",9317,Declarer
"C9 CK ST H8 HT HK HA D7 D8 DA","S8 HQ",false,1,"D9:100, DK:100, D8:0, S7:100, ST:0, S9:100",7074,Left
"C9 CA S7 S8 ST HT HJ HK HA D9","CK DK",false,1,"D7:100, D9:0, D8:100",3105,Right
"CK S7 S8 S9 ST SA H8 D9 DK DA","CJ H9",false,1,"S7:0, SJ:98, SK:100, C7:98, CK:0, C8:100",6217,Declarer
"C8 CJ CK H7 H8 HT HK DT DK DA","HJ HA",false,1,"H7:0, H9:95, HQ:93, S7:93, DA:0, SK:100, D7:98, DQ:80, DT:0, DJ:75, DK:0, D8:100",11083,Declarer
"C8 CT CJ ST H7 H8 HA D7 DT DQ","CK SK",false,1,"S7:100, ST:0, SQ:98, C7:100, C9:100, C8:13, D8:100, DT:13, D9:100",10918,Right
"C8 SK SA H7 HJ HQ D7 D9 DQ DK","C9 DT",false,1,"H7:0, H9:100, HA:100, S7:100, SK:0, S8:100",8086,Declarer
"CT CQ CK S7 HQ HK DT DJ DQ DK","CJ D8",false,1,"C9:100, CT:0, CA:100, C7:100, SA:100, CQ:0",9690,Right
"C9 CT CJ CQ H7 H9 HA D7 DJ DA","S8 D9",false,1,"D8:100, D7:0, DK:100, C7:100, CA:100, CQ:3, S7:95, HA:0, SK:98, HJ:98, HT:65, H9:5, H8:90, HK:75, H7:5, DQ:60, DJ:13, CK:80, ST:13, DA:23, SJ:100, C8:100, SA:100, C9:0",31721,Right
"C8 CT CA H7 H9 HK D7 D8 DJ DQ","CK DA",false,1,"C7:95, C8:0, CQ:100, DT:98, DK:100, DQ:8, S8:100, CA:38, SA:98, HQ:95, HA:98, HK:48, HJ:83, H9:70, HT:68, D9:68, D8:73, SK:43, C9:43, CT:78, S7:100",32898,Right
"C9 CT CJ SJ SA HT HQ D8 D9 DQ","S9 HJ",false,1,"S7:100, SK:100, SJ:0, D7:100, D8:0, DK:100, C8:100, CQ:100, CJ:0, H8:98, HT:0, H7:100",13791,Left
"C9 CT CJ CQ CK S8 H7 HT D8 D9","HJ HA",false,1,"C7:100, DA:100, C9:0",3414,Left
"CT CJ CK S7 H7 H9 HT DT DJ DQ","C8 HQ",false,1,"D7:100, DT:0, DA:100, H8:100, HA:98, HT:0, S8:98, S7:0, SK:100, S9:95, SJ:78, CK:0, CQ:75, CJ:0, C9:78, HJ:63, H9:8, DK:78, ST:8, CT:33, SQ:88, D8:80, CA:60, DJ:0",27887,Right
"C7 CJ CA S8 SJ SK H7 HJ D9 DA","CQ DJ",false,1,"ST:98, SA:100, SK:0, S7:100, S8:0, SQ:95, H8:100, H9:100, H7:0, C8:98, C7:0, CT:100, D7:85, D8:100, D9:0",19489,Left
"C8 CT S8 ST SJ SA HQ HA D8 DK","SQ D9",false,1,"S7:100, S8:0, SK:100, C7:98, CA:100, CT:0, H9:100, HQ:0, H7:100",10293,Right
"CT CJ CK S9 SJ SQ H9 HT D8 DK","ST SA",false,1,"C7:98, C8:100, CT:0",3711,Left
"CK CA H9 HT HQ HK HA D7 D8 DT","C8 CQ",false,1,"D7:0, DA:100, DJ:100, C7:100, CT:100, CK:0",6883,Declarer
"CJ S7 S9 SQ HQ HK D9 DT DJ DK","C7 D7",false,1,"H7:100, H9:98, HQ:0",4527,Left
"C7 CQ CK CA S7 S9 H9 D7 D8 D9","H7 DA",false,1,"SK:100, SA:93, S9:0, HA:95, H9:5, HK:98, C9:93, C7:3, CT:98, DT:98, DK:78, D9:0, CJ:78, CQ:0, C8:100",21376,Left
"CK CA SJ SQ SK H8 H9 D9 DT DQ","S8 SA",false,1,"H7:100, HA:98, H9:0, S7:98, SJ:0, S9:100",7703,Left
"C7 C9 CK S9 SA H8 HK D7 D9 DT","SQ DA",false,1,"D7:0, DK:93, DJ:100, S8:98, SK:100, S9:0, S7:98, SA:0, ST:100",11594,Declarer
"C8 CQ CK SA H7 HK D8 DT DJ DA","SK HA",false,1,"H7:0, HQ:100, HJ:100, S8:100, SQ:100, SA:0",8219,Declarer
"CT CK S7 HJ HQ HA D8 DJ DQ DK","CQ DA",false,1,"S7:0, SA:98, SK:100, C8:98, CA:100, CK:0, H7:100, HJ:0, H9:100",11988,Declarer
"C9 CT CK CA ST SK H7 H8 H9 D8","S9 D7",false,1,"S8:95, SA:100, SK:0, S7:95, ST:3, SJ:98, HT:95, HK:98, H9:5, C8:93, C9:23, C7:100",16010,Left
"CJ ST SJ H7 H9 HJ HA D7 DT DK","HT HQ",false,1,"H8:100, HK:100, HJ:0, S7:100, ST:0, SA:100, D8:98, DQ:98, DT:0, C7:98, CJ:3, CK:98, S8:93, S9:85, SJ:0",17804,Left
"C7 C8 C9 S9 ST SQ HT HQ DJ DK","H9 HJ",false,1,"H7:98, HT:0, HA:100, S7:100, S8:100, S9:0",8104,Right
"CT S7 ST SK SA HT HJ HK DT DA","SJ HQ",false,1,"D7:100, DT:0, DQ:100, C7:100, CA:95, CT:0, H8:100, HT:0, H7:100",12195,Right
"C8 CT CA S8 S9 SQ HT HJ D8 DJ","C9 HK",false,1,"S7:100, SK:90, SQ:0, C7:98, C8:0, H7:100",9298,Left
"C8 C9 CT CJ CQ H8 HT D8 D9 DJ","CK H7",true,0,"S7:100, DJ:5, SJ:100, CA:100, C7:93, CQ:55, H9:95, HA:70, HT:40, DT:75, D9:63, DK:98, HJ:83, HK:33, H8:85, S8:50, D8:100, ST:58, D7:63, DA:0, CJ:100, SQ:0, CT:100, S9:0, SK:0, C9:100, DQ:0, SA:0, C8:100, HQ:0",40174,Right
"CQ S9 ST HT HQ HA D7 D8 DJ DQ","SQ SK",false,1,"C7:100, CJ:100, CQ:0",4111,Left
"C8 CQ CK CA SK HJ D7 DT DQ DA","H7 HT",false,1,"C7:100, CT:100, C8:0, D8:100, D7:0, DK:98, S7:98, SA:98, SK:0, S8:100, CA:3, ST:90, CJ:85, C9:98, CQ:0",17903,Left
"C7 CT CA ST SQ SK H7 DQ DK DA","S7 SJ",false,1,"C7:0, CQ:100, CK:90, S8:100, ST:0, S9:100",7708,Declarer
"C7 CT S7 HT HJ HQ HA D8 D9 DA","CK H9",false,1,"C7:0, CA:100, CQ:98, D7:100, DK:98, D9:0, S9:100, S7:0, SA:100, C8:93, C9:100, CT:0",14282,Declarer
"C9 CT CQ S9 ST HQ HA D9 DT DK","CA DA",false,1,"D7:100, DJ:98, DT:0, S7:100, S9:0, SK:100, H8:100, HK:98, HQ:0, H7:95, HA:0, H9:100",14211,Left
"CT CJ S8 S9 ST SJ SQ HT D8 DA","C9 D7",false,1,"D9:100, DQ:100, D8:0, H7:90, HT:0, HQ:98, S7:98, SA:33, SQ:0, CK:38, CJ:0, CA:93, C7:95, HA:95, CT:0",19408,Left
"C7 CK S9 H9 HJ HK HA D9 DJ DQ","C8 S7",false,1,"H7:98, H9:0, H8:100",5675,Right
"C8 CT CQ CK S7 SK H9 HK D8 DK","CJ S8",false,1,"S7:0, SA:100, SQ:100, H8:100, HQ:100, H9:0, C7:100, C8:0, C9:98, D9:93, DA:100, DK:0, H7:100, HK:0, HT:100",14796,Declarer
"C9 CT CJ SQ H8 HJ HQ HK D7 DQ","H9 DT",false,1,"D7:0, DK:100, DA:100, C7:100, C9:0, CA:100, C8:98, CQ:98, CJ:0, S7:100, SQ:0, S9:100",8919,Declarer
"C7 C9 CQ CK CA H9 HK D7 D9 DK","ST DJ",true,0,"S7:98, HK:15, SA:98, CT:95, C8:88, C9:18, D8:98, DT:88, D9:30, H7:88, H9:52, HJ:75, CJ:80, HA:65, C7:95, DQ:33, HQ:8, D7:0, SJ:0, S9:0, DK:100, SQ:0, S8:0, CA:100, SK:0, HT:0, CK:100, DA:0, H8:0, CQ:100",33098,Right
"C7 CT SK SA H9 HT HJ D7 D9 DQ","HK DA",false,1,"H7:100, HA:98, HJ:0, S7:100, SK:0, SJ:100",5282,Left
"C8 S7 S9 ST SJ H7 HT HK D8 DT","CQ D9",true,0,"H9:98, HA:100, HK:50, D7:100, D8:55, DA:95, DK:80, DQ:90, DT:90, S8:90, SK:95, SJ:100, H8:90, H7:100, HQ:65, C9:60, CJ:83, C8:100, C7:60, ST:100, CA:0, HJ:0, CK:30, HT:100, SQ:0, DJ:15, S9:100, SA:0, CT:0, S7:100",33229,Left
"CJ CQ CA S9 ST SQ SK HA D8 DK","HQ DA",false,1,"D8:0, D9:100, DQ:100, C7:100, CJ:0, C8:100",4878,Declarer
