Hand,Skat,Won,Points,Moves,DurationMs,StartPlayer
"CJ CQ CA S9 SJ H8 HA D7 D9 DQ","CK S7",false,1,"D7:0, DA:100, DJ:100, H7:95, H9:100, H8:0, C7:100, CJ:0, CT:100",6501,Declarer
"S8 ST SJ SK H7 HQ HK D7 D8 DK","S7 S9",false,1,"C7:98, CK:100, SK:0, D9:93, D8:5, DA:95, H8:93, HJ:95, H7:0, DQ:95, D7:0, DJ:93, SQ:98, SJ:0, SA:45, C8:52, C9:90, DK:20, H9:98, HQ:10, CT:100",18592,Left
"C8 CT CJ SA H7 H8 HJ HK D7 DT","C7 ST",false,1,"H7:0, HQ:100, HA:100, S8:98, SA:0, S7:100",5897,Declarer
"C9 CJ CQ CA S7 H9 HK D7 DT DJ","C8 HJ",false,1,"S7:3, SK:100, SA:100, H7:100, H9:0, H8:100",5492,Declarer
"S8 S9 ST SK H8 H9 HK HA D7 DK","S7 HQ",false,1,"C7:100, CK:98, DK:5, DT:88, D7:5, DA:95, HT:88, HJ:83, H9:10, SQ:83, ST:13, SJ:73, DQ:75, HA:13, DJ:58, H7:100, H8:20, C8:100",17201,Left
"C9 CQ CA S7 S9 SQ H9 HT HQ D7","CT DT",true,0,"C7:100, CK:100, CQ:3, D8:100, D7:3, DA:93, H7:98, HA:98, HQ:0, ST:100, S9:5, SJ:90, S8:90, SA:95, SQ:8, C8:95, C9:18, CJ:88, DJ:70, D9:50, CA:63, H8:73, HJ:0, HT:100, DQ:0, H9:100, DK:0, HK:0, SK:0, S7:100",36486,Left
"C7 C8 CT CJ S9 SQ H7 H8 HT D9","S7 HK",false,1,"C7:3, CA:95, CQ:95, H9:98, HA:90, HT:3, S8:93, S9:3, SK:90, ST:98, SJ:85, SQ:0",21921,Declarer
"C8 C9 ST SQ SK H7 H8 HJ HQ D9","CK S8",false,1,"D7:100, D9:0, D8:100",4080,Right
"CT S7 H7 H9 HT HJ D7 D8 D9 DK","DT DA",true,0,"CT:38, CA:100, C9:100, S9:93, SJ:100, S7:100, H8:100, H7:100, SA:93, C8:100, DK:100, C7:90, DJ:83, D9:100, DQ:0, CJ:0, HA:23, HJ:100, SQ:0, ST:58, HT:100, CQ:0, HK:0, H9:100, CK:0, HQ:0, D8:100, SK:0, S8:0, D7:100",50898,Declarer
"CT CK CA S7 S8 SQ HJ HK HA D9","H8 DQ",false,1,"S7:0, SK:98, SA:100, C7:100, CT:0, C9:100",7707,Declarer
"C8 CJ CK S7 ST SJ H8 HJ HA D9","S8 SQ",true,0,"D7:100, DA:88, D9:0, CA:88, CK:0, CQ:100, S9:95, S7:0, SA:100, H7:98, HK:0, HJ:5, D8:0, HA:8, HQ:35, DT:0, CJ:55, CT:25, DJ:0, C8:73, HT:30, DQ:0, SJ:93, C9:35, DK:0, ST:100, H9:23, SK:0, H8:100, C7:0",30906,Left
"C7 CT S7 SK HT HQ D9 DT DJ DA","C9 CQ",false,1,"D7:100, D8:100, D9:0",2306,Left
"C7 C9 CT S7 S8 SQ HT HK DT DQ","H8 H9",false,1,"S9:98, SJ:100, S8:0, D7:100, DT:0, DA:100, HJ:98, HQ:100, HT:0, DJ:98, DQ:0, D9:100",11887,Left
"C9 CT CQ CK S7 S8 SJ SK H9 DA","S9 DJ",false,1,"D8:100, DA:0, D7:100",2595,Right
"C7 C8 CT CJ S9 ST H7 HT D9 DK","HQ DQ",false,1,"C7:3, CK:95, CA:100, S8:100, S9:0, SK:100, D8:98, D7:98, D9:0",8402,Declarer
"C7 CT CJ CQ CK HK HA DJ DK DA","S8 HQ",false,1,"C7:0, CA:98, C8:100, H7:100, HJ:100, HK:0",4429,Declarer
"CT CJ CQ S7 ST H7 H8 HQ DT DQ","HJ DK",false,1,"S7:0, SQ:100, SA:95, C8:98, CT:0, C7:100",4572,Declarer
"CJ CQ CA S7 S9 SQ SA HT DT DK","CK DJ",false,1,"S7:0, SJ:98, SK:98, H7:100, HT:0, H9:100",4615,Declarer
"CQ S7 S9 SQ H9 HK HA D8 D9 DT","C8 C9",false,1,"C7:100, CQ:0, CA:100, D7:100, DK:98, DT:0, H8:88, H9:3, H7:100",6592,Right
"C7 CJ CA S9 H7 H8 HA DT DQ DK","H9 HQ",false,1,"S7:100, S9:0, SK:100, D7:100, DJ:100, DT:0, S8:95, CA:0, SQ:100, C9:100, C8:83, C7:3, HT:85, HJ:68, H8:5, D9:50, DQ:8, D8:100",11109,Right
"C8 CT CK SA H7 HT HJ HA DQ DK","H8 DT",false,1,"S7:100, SK:100, SA:0",2279,Left
"C7 C8 CK S7 S8 H7 H9 HQ DK DA","CJ CA",false,1,"D9:100, DK:0, D7:100",5303,Right
"ST SQ SA H7 H8 HT HQ D7 DJ DA","D8 DT",false,1,"S7:98, HA:100, ST:0",4809,Left
"C9 CT CJ S8 S9 ST H9 HA DT DJ","SJ SK",false,1,"H7:100, HQ:100, H9:0, S7:100, S8:0, SQ:95, D7:93, DK:100, DJ:0, C7:93, C9:0, CK:98, D8:88, SA:95, DT:0",18293,Left
"C8 CK CA SJ H8 H9 HT HA DJ DQ","S7 D7",false,1,"H8:0, HK:98, H7:100, C9:95, CT:100, C8:0, C7:100, CK:0, CJ:100",12788,Declarer
"C7 CT CK CA S9 ST SJ SA D8 DT","S7 DA",false,1,"C8:100, C7:0, CQ:100, D7:100, DK:98, DT:8, S8:95, S9:5, SK:100, C9:100, HA:98, CT:0",16924,Right
"C8 C9 S9 SJ H9 HJ HQ HK D8 D9","DJ DA",false,1,"C7:100, C8:0, CJ:98, H7:100, HA:98, HK:5, S7:100, S9:5, SA:100, CT:100, CA:80, C9:0, DQ:95, D9:3, DT:93, S8:90, SJ:15, ST:100",22889,Right
"C8 CQ S7 SK H9 HQ HK D7 DQ DK","HA D9",false,1,"D7:0, DA:98, DJ:100, H8:93, H7:100, H9:0",6410,Declarer
"C8 CK S7 ST SK H8 HT HJ D9 DK","H9 DT",false,1,"C7:100, C8:0, CA:98, D7:98, DJ:98, D9:0, S9:95, S7:0, S8:100, HQ:95, HJ:0, HK:95, H7:93, HA:95, HT:0, CJ:93, CK:0, C9:100",16992,Right
"C9 CT CK CA SK H7 D7 D9 DQ DA","CJ HQ",false,1,"D8:100, DK:100, DQ:0, HT:100, H7:0, HA:100, DT:95, SQ:98, D9:0, DJ:100, S9:95, D7:0, H8:90, HJ:100, SK:20, CQ:83, CT:25, SA:68, C7:100, C9:0, H9:100",20784,Left
"C8 CQ S7 H9 HQ D8 D9 DT DJ DQ","SA H8",false,1,"D8:3, DK:100, DA:100, S8:100, S7:0, SQ:100, H7:100, HK:100, HQ:3, CT:90, C8:8, CA:98, S9:90, SK:78, CQ:15, HJ:80, H9:20, HA:83, C7:80, CK:83, DQ:33, D7:100, D9:0, C9:100",21804,Declarer
"C9 CJ CA S7 S9 SK H9 DT DJ DK","D8 D9",false,1,"D7:98, DA:100, DK:0, H7:98, H9:0, HQ:93, C8:93, C7:98, C9:0",9412,Left
"CJ S7 SJ SA H8 HJ HK HA D9 DK","S9 D8",false,1,"C7:100, CJ:0, CA:100, S8:98, SK:100, SJ:0, D7:100, D9:0, DA:100, ST:95, SQ:95, S7:0, H9:98, H8:0, HQ:98, C9:85, C8:75, DK:5, DT:80, DQ:43, SA:23, HT:35, HJ:0, H7:100",22477,Right
"C8 CK S7 SQ HT HQ HK DJ DQ DA","H7 D9",false,1,"H9:100, HT:0, HA:100, C7:100, CA:98, CK:0, C9:100, C8:0, CQ:100, CJ:98, CT:88, DA:0, S8:95, SA:90, SQ:0, ST:88, S7:0, S9:80, HJ:95, HQ:0, H8:100",19012,Right
"C9 CK S8 ST H9 HQ HK D8 D9 DT","C7 HA",false,1,"D7:100, DA:100, DT:0, H7:100, H9:0, H8:100",5709,Left
"CT SJ SA H8 HT HJ HQ HA D7 D9","C9 DQ",false,1,"S7:100, SJ:0, SQ:100, C7:100, C8:100, CT:0",6614,Right
"CJ CQ CK SA H9 HJ D8 DQ DK DA","SQ SK",false,1,"C8:100, CJ:0, CA:100, D7:100, DJ:100, D8:0, HT:100, H9:0, HQ:100, D9:100, DT:98, DQ:0",10289,Right
"C7 C8 CA ST SJ SQ HA D9 DJ DQ","H8 DA",false,1,"H7:100, HK:100, HA:0",2082,Left
"C7 CJ CQ CA S7 ST SA HK D9 DT","C9 HJ",false,1,"D7:100, DA:100, DT:0, S8:100, S7:0, SK:100, D8:98, DK:98, D9:0, H7:100, HK:0, H8:100",9693,Left
"CT CJ CQ ST HK DT DJ DQ DK DA","CK SK",false,1,"DT:0, D8:100, D7:100",1916,Declarer
"CT S7 SK HK HA D8 D9 DT DQ DA","S9 HQ",false,1,"SJ:95, ST:100, S7:0, HJ:98, HT:100, HK:0",13682,Left
"C8 CJ S7 S9 ST SJ HK DJ DQ DK","C7 HT",false,1,"SK:100, SJ:0, SA:98, H7:100, H9:95, HK:0",6825,Right
"C7 CQ CK CA S8 ST HA DT DQ DA","S7 S9",false,1,"C7:0, CT:100, CJ:100, D7:100, DT:0, DK:98, C8:98, C9:98, CQ:0",7299,Declarer
"CJ S9 SQ SK H7 H8 HT HK HA DT","CK D9",false,1,"H7:0, HQ:95, H9:98, S8:100, ST:98, S9:0, S7:100, SQ:0, SJ:100",9914,Declarer
"CK S7 S9 SQ SA HT HQ DT DK DA","SJ D8",false,1,"S7:0, S8:98, SK:100, C7:100, CK:0, C8:100",7675,Declarer
"CT CQ CA ST SA H7 H9 D8 DQ DK","CK HK",false,1,"S7:100, SQ:100, ST:0, D7:100, D8:0, DT:98, C9:95, C8:100, CT:0",11381,Left
"C9 CQ S9 ST SK H9 HQ HK HA DT","H7 D9",false,1,"H9:0, HJ:100, HT:98, S7:100, SA:98, SK:0, S8:93, S9:0, SQ:95, CK:95, CJ:88, CQ:3, D7:90, DA:88, DT:0, H8:88, HQ:0, D8:100",22718,Declarer
"C8 CQ CK CA S9 SQ H7 HJ HQ DQ","S7 DT",false,1,"D7:100, DK:100, DQ:0, C7:100, C8:0, CJ:100, S8:100, SA:95, SQ:0, H8:98, H7:0, HK:100, ST:100, SK:100, S9:5, CT:88, CQ:0, C9:100",21985,Left
"C9 CK S7 S8 S9 SQ H9 HT D8 DT","SJ D7",false,1,"C7:98, CQ:100, C9:3, D9:100, D8:3, DQ:98, H8:100, H7:100, H9:0",13129,Left
"CQ S7 S8 ST HT HQ HK D7 D8 DT","HJ DJ",false,1,"C8:100, CJ:100, CQ:0",4868,Left
"C8 C9 CJ SJ SQ H8 HJ HA D7 DA","HQ DJ",false,1,"D7:0, DQ:98, DK:100, D8:100, DA:0, S7:100",8597,Declarer
"C7 C9 SK HT HJ HQ HK DJ DK DA","C8 CJ",false,1,"D7:100, DJ:0, DQ:100, S7:98, SJ:93, SK:0",8099,Right
"C7 C9 CT CJ SQ SK HT HJ HK DA","CK D9",false,1,"H7:98, H9:100, HT:0",4830,Left
"CJ CQ S7 S8 S9 SQ H8 HJ D9 DK","C7 ST",false,1,"S7:0, SJ:98, SA:100, H7:100, H8:0, HA:100, C9:98, C8:100, CJ:0",12290,Declarer
"C8 CQ CA H8 HT HJ HK DT DQ DK","C9 HQ",false,1,"H7:100, H8:0, HA:100, C7:100, CJ:100, C8:0, S7:100, DK:3, SK:90, D8:83, D7:98, DT:0",14484,Right
"C8 SQ SA H9 HJ HQ D7 D9 DJ DQ","CT D8",false,1,"D7:0, DA:98, CA:98, ST:100, SK:100, SQ:0, HT:95, H9:0, HA:93, DT:88, CK:98, D9:0, DK:90, S9:90, DQ:0, CJ:70, CQ:85, C8:0, S7:80, SA:0, SJ:100",28923,Declarer
"C8 C9 CT CK S8 ST H7 H8 H9 HK","CJ HQ",false,1,"C8:10, SA:98, CA:100, C7:100, C9:0, D7:100",15785,Declarer
"C8 CA S8 ST SK H8 HQ D9 DJ DK","S7 HA",false,1,"C7:98, C8:0, D7:100",3391,Right
"C7 CJ CQ S9 H7 HT HQ D7 D9 DQ","CK SK",false,1,"H8:98, H9:98, H7:13, S8:100, S9:0, S7:100",12117,Left
"C7 SQ SA H8 HQ HK D7 D9 DQ DA","CA SK",false,1,"S9:98, SQ:0, S7:100",3993,Right
"C8 C9 CT S7 SK HT D7 D8 DK DA","HJ HK",false,1,"S7:0, SA:100, SQ:100, DT:95, DQ:100, D8:0, C7:98, C8:0, CA:88, HQ:88, H9:98, HT:3, S8:83, SJ:95, SK:0",19781,Declarer
"C7 CJ CA S7 SK H7 H8 HQ DJ DQ","S8 DA",false,1,"D7:98, DK:93, DQ:0, C8:88, C7:0, CQ:100, S9:100, ST:90, S7:0, DT:85, DJ:0, D8:100",20910,Left
"CK S7 SQ H8 HT HA D7 D8 DJ DQ","H9 DT",false,1,"C7:100, C9:98, CK:0",4112,Left
"CT CK S8 SJ SQ SA D8 DT DJ DA","H8 DK",false,1,"H7:100, HA:100, SA:0, C7:100, CT:0, CA:95, D9:95, DQ:93, DJ:0, S9:95, S8:0, SK:85, S7:90, HK:100, SJ:0",19978,Left
"C7 C9 CJ S7 ST SQ SK D8 DT DK","HJ D7",false,1,"ST:8, SA:100, SJ:100, H9:95, HK:98, DK:28, C8:93, C7:35, CA:83, DJ:90, D9:75, DT:40, CK:88, CQ:43, CJ:60, S8:88, DA:55, S7:0, S9:100, HQ:100, SQ:0",34807,Declarer
"C7 C9 CA S7 S9 SK H7 H9 DJ DQ","S8 HK",false,1,"CT:100, C9:0, CK:100, C8:98, SA:100, C7:0, CJ:100, DA:95, CA:0",14005,Right
"CT CQ CA S7 S8 SK H7 D9 DK DA","CK DT",false,1,"H7:0, HA:100, HQ:100, D7:98, D8:100, D9:0",6811,Declarer
"CQ CK CA S8 ST SK HQ DT DJ DQ","HT DA",false,1,"S8:0, SQ:98, SA:100, H7:100, HQ:0, HA:100, C7:98, CT:95, CQ:0",10892,Declarer
"C7 S7 SJ SQ H7 H8 HT HQ HK DA","HA D8",false,1,"D7:100, DA:0, D9:100",3582,Right
"C7 C8 C9 CJ ST SA HJ D7 D8 DK","CA H9",false,1,"D9:98, D8:0, DQ:100, S7:100, SK:90, ST:0, CQ:100, CJ:0, CT:100, CK:98, C9:0, DJ:100, H7:70, HJ:0, H8:100",17620,Right
"C8 CJ SJ SK SA H7 HK HA D8 DT","C7 S7",false,1,"H8:100, HQ:100, H7:0, S8:100, SJ:0, S9:100",7192,Left
"C9 S7 SK H8 H9 HA D7 D9 DK DA","S9 SA",false,1,"D7:0, DQ:100, DJ:95, H7:100, HK:93, H9:0, C7:80, C9:0, D8:100",11504,Declarer
"C8 CT CJ CQ CA H8 HJ D9 DT DA","HT D7",true,0,"H8:0, HA:100, HK:100, H7:100, HQ:100, HJ:10, S7:100, DA:3, SK:93, DJ:93, DK:88, DT:3, C7:93, C8:18, C9:70, H9:70, CK:75, D9:100, S8:0, SA:3, CA:100, S9:10, CQ:100, ST:0, D8:0, SQ:30, CJ:100, DQ:0, SJ:0, CT:100",38401,Declarer
"C8 ST SA H8 H9 HQ HA D9 DT DJ","C7 S9",false,1,"D7:100, D9:0, DK:100, HT:100, H7:93, H9:0, S7:100, S8:100, ST:0",10184,Right
"C9 CQ CK S9 SJ SA H9 HK DT DK","SK DA",false,1,"S8:100, S9:0, SQ:100, D7:100, DQ:100, DT:0, D9:100, DK:0, D8:100",9816,Right
"CT SJ SQ SA H8 H9 D8 DT DK DA","CK HQ",false,1,"D8:0, DQ:100, D7:100, S7:100, SK:100, SQ:0, C7:100, CT:0, C8:100",8383,Declarer
"C8 C9 CQ S9 SJ H8 HT HK HA DT","D9 DA",false,1,"C8:0, CK:98, CA:100, H7:98, H8:0, HQ:100, S8:100, S7:100, S9:0",10308,Declarer
"CJ S8 SK SA H7 H9 HT HJ D9 DK","C8 SQ",false,1,"H7:0, HK:100, HA:100, ST:100, S8:0, S9:98, D7:98, D9:0, DA:98, C7:93, CK:95, CJ:0, SJ:98, SK:0, S7:100",16306,Declarer
"CT CJ CQ CA S8 S9 SJ SK HQ DA","HT DT",false,1,"H7:100, H9:100, HQ:0",3701,Left
"C8 CJ S7 SJ SK H7 HK D8 D9 DQ","S8 S9",false,1,"C7:98, C8:0, CK:100, D7:95, DT:100, D9:0, H8:98, H7:0, HA:85, SA:85, ST:88, SK:0, H9:95, HJ:80, HK:0",17990,Right
"C8 C9 S8 ST SK H9 HT DQ DK DA","CJ D9",false,1,"C7:100, C8:0, CK:98, H7:98, HQ:98, HT:0, S7:95, S8:0, SA:100, D7:93, DJ:95, DQ:0",13107,Right
"CK S8 S9 ST SQ SA H9 HQ HK HA","H7 D9",false,1,"C8:100, CK:0, C7:100",4494,Right
"C8 CA SJ SQ SA H8 HT D7 DJ DQ","CK S7",false,1,"S8:100, SJ:0, S9:100",3811,Right
"CT CK SJ SQ SK SA H8 D9 DK DA","HA DJ",false,1,"H7:100, HK:100, H8:0, D7:100, D9:0, DQ:100, C7:100, CQ:98, CT:0, S7:100, SJ:0, S9:100",11299,Left
"C9 S7 SK SA H8 HT HQ D7 D8 DT","CJ DA",false,1,"H7:100, H8:0, HA:98, S8:93, SQ:100, S7:0, D9:98, D8:0, DK:95, CQ:100, CT:90, C9:0, DQ:98, DJ:88, DT:3, HJ:100, HK:78, HQ:0, ST:83, SK:0, S9:100",22281,Right
"S9 SQ SA H7 H9 HT HJ DT DJ DA","H8 HA",false,1,"S7:100, S9:0, SJ:98, D7:100, DQ:95, DJ:0, C7:90, SA:3, CA:75, HQ:88, SK:73, HJ:0, HK:30, CK:65, HT:3, D8:30, CJ:100, DT:0",21407,Right
"C7 C9 CA SA H7 H8 HK D8 DQ DK","ST DT",false,1,"H7:0, HT:98, HA:100, C8:100, C7:0, CJ:100, CT:95, CK:88, C9:0, S7:98, SA:0, S8:100",13311,Declarer
"C7 C9 CT CQ CK SK SA H8 HJ DJ","SQ DT",false,1,"D7:98, D9:100, DJ:0",5398,Left
"C7 CK S9 SJ SQ SA HQ D7 DT DA","C8 ST",false,1,"D7:0, DK:100, DQ:100, S8:100, S7:100, S9:0",6797,Declarer
"CJ SJ SK HT HJ HQ HK D7 DT DK","CK S7",false,1,"D7:0, DQ:100, DA:100, H7:100, HT:0, H9:100",6098,Declarer
"C8 CT CQ CA S7 ST SK HK DJ DQ","SA H9",false,1,"S7:0, S8:100, SQ:98, D7:100, DJ:0, D9:100",6674,Declarer
"C7 CJ CA S9 ST HT HJ HQ DT DQ","H7 HA",false,1,"S8:100, S9:0, S7:100",3619,Right
"CJ CK SQ SK SA H7 H8 HK D7 DT","D8 D9",false,1,"C7:100, CT:100, CJ:0",3481,Left
"CT CK CA S7 S8 SJ SA HT HJ DA","CQ DQ",false,1,"S7:0, SK:100, ST:100, D7:100, DJ:100, DA:0",5224,Declarer
"C7 S9 SJ SK SA HQ HK D9 DT DJ","HA DA",false,1,"C7:0, CK:100, CA:100, S7:100, S9:0, S8:100",6980,Declarer
"C8 CT CK S8 HK D8 D9 DT DK DA","C7 D7",false,1,"D8:0, DQ:90, SK:100, DJ:68, HQ:98, DT:0, CA:45, CQ:100, CK:0, H9:58, H8:98, HK:0",13911,Declarer
"C9 S7 SJ SQ SK H8 HT HK D7 D8","C7 DQ",true,0,"ST:98, S7:3, S9:98, D9:98, D8:3, DA:98, S8:98, SA:93, SK:5, CQ:95, C9:20, CK:93, C8:88, CA:90, HK:80, DK:100, D7:80, DJ:75, HQ:100, HT:88, HJ:40, H7:95, H8:70, H9:0, CT:0, HA:0, SQ:100, CJ:0, DT:0, SJ:100",36199,Right
"C8 CT S9 SA H9 HJ D9 DQ DK DA","C7 D8",false,1,"C8:0, CK:100, CA:100, D7:100, D9:0, DJ:100, S7:98, S8:100, S9:0",9990,Declarer
"C8 S9 H7 H8 H9 D8 DT DQ DK DA","CA HQ",false,1,"C7:100, CQ:98, C8:3, S7:95, S9:8, SA:98, HT:100, HA:100, H9:28, D9:100, D8:43, DJ:95, HK:88, HJ:85, H8:20, CJ:95, CT:85, DA:30, SJ:85, ST:70, DK:43, D7:100, SK:100, DT:0",26910,Left
"CT CA ST SJ SQ SK HT D7 DJ DA","S7 H9",false,1,"C7:100, CT:0, CK:100, H8:100, H7:95, HT:0",5909,Right
"C9 CT S7 S8 SJ SA H7 H8 D7 DK","SK HA",false,1,"C7:98, CJ:93, CT:15, S9:95, S8:8, SQ:100, C8:95, CA:98, C9:3, D9:90, D7:3, DQ:100, D8:100, DJ:68, DK:0",18318,Left
"C7 CJ ST SQ H7 H9 HA D7 DJ DQ","S7 HJ",false,1,"S8:98, ST:0, S9:100",6487,Right
"C7 CQ CK S8 S9 ST H9 D7 DT DK","SJ HK",false,1,"D7:0, DA:98, DJ:100, D9:100, D8:98, DT:0",5597,Declarer
"CQ S7 ST SJ SQ H7 H8 D7 DQ DA","C7 SK",false,1,"C9:100, C8:100, CQ:0",3714,Left
"C8 CQ S7 SJ SK HT HK HA D9 DQ","SQ DA",false,1,"D7:100, DJ:100, D9:0, H7:98, HT:0, HJ:100, C7:100, CK:100, CQ:0, S8:100, S7:0, ST:100, H8:100, HQ:95, HK:0",14789,Left
"C9 CJ CK CA ST SK H8 HJ DQ DA","CQ HK",false,1,"D7:98, DQ:0, D8:100",3100,Right
"C7 C8 S8 ST SQ HT HQ HK DJ DK","CT H7",false,1,"D7:100, DJ:0, D8:100",3406,Right
"C7 CQ CA ST SJ H9 HQ HK D9 DQ","CT CK",false,1,"C7:0, CJ:100, C9:98, S7:98, SQ:100, SJ:0, D7:98, D9:0, D8:100",9485,Declarer
"C9 CQ CK S7 S8 SJ SQ HA D7 DQ","SK D9",false,1,"D7:0, SA:98, DA:100, C7:100, C9:0, CA:100, S9:95, DK:100, S8:0, ST:100, HJ:95, S7:0, CJ:78, CT:78, CQ:0",16699,Declarer
"CQ CK CA S8 S9 SK H7 HQ HK DA","SJ D9",false,1,"D7:100, DQ:100, DA:0",3108,Left
"C8 CT CJ CQ H7 H9 HJ DT DJ DA","ST D9",true,0,"H7:5, HK:100, HA:100, D7:100, DT:0, DK:95, S7:100, SA:100, DA:3, C7:98, C8:5, CA:100, DQ:100, D8:70, DJ:10, CK:95, C9:0, CQ:55, H8:100, HQ:0, HJ:100, S8:0, CJ:100, SK:0, HT:0, SQ:0, H9:100, SJ:0, S9:0, CT:100",29391,Declarer
"C7 C9 CT CQ H7 HT HK D7 DJ DQ","SJ H8",false,1,"C7:8, C8:98, CA:90, D8:95, D7:5, DK:100, D9:100, DA:93, DQ:5, H9:93, H7:5, HA:85, HJ:95, SA:78, HT:0, HQ:80, SK:65, HK:0",23999,Declarer
"C7 CT CA S7 ST H8 H9 HA DQ DA","SQ HT",false,1,"D7:100, DJ:98, DQ:0",3211,Left
"CA S7 S9 SK H7 H8 HQ HK HA D9","C8 S8",false,1,"S7:0, SA:95, SQ:98, C7:100, CK:95, CA:0",6213,Declarer
"C8 CA S7 SJ H7 H9 HT HJ HA D7","CK DT",false,1,"S7:0, SK:100, SA:98, D8:98, D7:0, DA:100, C9:100, CQ:98, C8:0, S9:95, SJ:3, S8:100",11978,Declarer
"C7 S8 SQ SK SA H7 H9 HQ HA DJ","S9 D8",true,0,"D7:100, DJ:0, DA:100, H8:95, HJ:100, H9:0, C8:100, C7:3, CA:93, C9:100, CK:90, SA:10, DQ:100, SK:28, DK:43, SJ:58, ST:52, S8:28, HT:50, CQ:25, H7:50, D9:0, CJ:0, HA:100, DT:0, CT:0, SQ:100, HK:0, S7:0, HQ:100",29511,Right
"C8 SJ SQ SA H8 H9 HJ D7 DT DA","ST H7",false,1,"S7:100, SK:100, SQ:0, D8:100, D7:0, DK:100, C7:100, CA:85, C8:0, D9:93, DT:0, S8:100",11211,Left
"C8 CK SA HT HJ HA D8 DQ DK DA","CQ SK",false,1,"D8:0, DJ:100, DT:100, D7:100, SQ:100, DQ:0",5202,Declarer
"C8 CA S7 SQ H7 H8 HK D7 D9 DT","H9 DK",false,1,"D8:100, D7:0, DJ:100, S8:100, SJ:83, S7:0, ST:80, SQ:0, S9:100",10896,Right
"C7 C9 CT S9 H9 HT HJ D9 DQ DA","CQ SJ",false,1,"C8:98, CK:100, CT:0, H7:100, H9:0, HQ:100, S7:93, SK:100, S9:3, H8:100, HT:0, DT:100",14572,Left
"C7 CA SJ SK HJ D8 D9 DT DK DA","CQ HQ",false,1,"S7:100, SJ:0, SA:100, D7:100, DQ:100, DT:0, H7:100, HJ:0, HK:100, S8:100, ST:95, SK:0",11614,Right
"CK S7 S8 S9 ST SJ HJ HA D7 DQ","C9 DJ",false,1,"H7:100, HK:100, HJ:0, SK:98, SJ:0, SA:85, CQ:93, CJ:95, CK:0",10097,Left
"CJ CQ CK S7 S9 ST SQ SK D7 DK","H7 D9",false,1,"C7:100, C9:100, CJ:0",3212,Left
"C8 CA S7 SQ SK H7 H8 HQ HA D9","HK DQ",false,1,"D7:98, DK:100, D9:0, C7:98, C8:0, CJ:100, H9:98, HJ:95, H8:0, S8:93, S7:0, SA:95, HT:100, CK:80, H7:0, D8:60, DJ:73, CA:3, DT:40, SK:28, DA:0, S9:0, CQ:90, SQ:0",24774,Left
"CT CK CA S7 S8 SA H9 D8 D9 DT","C7 D7",false,1,"S7:0, SQ:100, SK:98, H8:100, H9:0, H7:100",7198,Declarer
"CT CA S9 SQ H9 HQ HA D9 DT DK","CQ DA",false,1,"S7:100, SA:98, SQ:0, C8:95, CT:0, C7:100",7227,Left
"C8 CJ SQ SK H7 H8 HT D8 DQ DA","C7 CK",false,1,"H9:98, HK:100, HT:0, D7:98, D8:0, DK:93, CQ:90, CT:93, CJ:0, HQ:93, HJ:93, H8:0, S7:93, ST:83, SQ:0",18500,Left
"SJ H8 H9 HK D8 D9 DT DJ DK DA","C8 CQ",false,1,"D8:0, DQ:98, HA:100, S7:100, SK:100, SJ:0, C7:100, DA:0, CA:100, D7:100, CK:100, D9:0",15980,Declarer
"C8 CA S9 ST SK HQ D8 D9 DJ DQ","H8 D7",false,1,"CT:83, C8:0, CJ:100, C7:100, CK:90, CA:0",10105,Right
"C8 CQ S8 SA H7 H8 HT HJ HQ DT","C7 CT",false,1,"H7:0, HA:100, HK:100, H9:95, DA:100, H8:0, S9:83, ST:98, S8:0, D7:100, DT:0, DK:65, C9:73, CK:88, CQ:0, S7:85, SA:0, SJ:100",20487,Declarer
"C8 C9 S7 S8 HT HA D7 D8 DT DQ","C7 DK",false,1,"ST:100, S8:0, SA:100, H7:100, H9:98, HT:0",7213,Right
"CT CK CA ST SK SA H8 HT HJ HQ","C7 H9",false,1,"H8:0, HA:100, HK:100, S7:98, S8:98, ST:0",6084,Declarer
"CK ST SA H8 H9 HJ HK D7 DT DQ","SJ HQ",false,1,"H7:100, DA:100, H8:0",2912,Left
"C7 S8 SK H8 HT HA D7 DJ DQ DK","S9 ST",false,1,"S7:100, S8:0, SQ:100, D8:100, D9:98, D7:0, C8:93, C7:0, CK:100, H7:98, HK:50, HT:5, SJ:50, SK:0, H9:100",15794,Right
"C9 CJ CA S7 SJ H7 H9 HT HJ D7","CQ HA",false,1,"C8:100, CJ:3, C7:100",3492,Right
"C7 CT CQ SK H8 D8 D9 DJ DQ DA","C8 CK",true,0,"H9:100, HK:100, H8:0, H7:100, SK:10, HA:90, S9:98, SA:100, CQ:18, C9:95, C7:25, CA:43, ST:45, S8:95, CT:30, SJ:28, SQ:100, DA:43, S7:100, DQ:48, DK:50, CJ:83, DJ:63, HQ:0, D7:25, D8:63, DT:0, HJ:0, HT:0, D9:100",30115,Left
"C8 CT S9 ST SJ H7 H8 H9 HK DQ","S7 SA",true,0,"D7:98, DA:98, DQ:8, C7:100, C8:3, CA:90, HT:93, HA:98, HK:5, S8:98, S9:5, SQ:0, D9:0, D8:90, SJ:58, DT:0, SK:35, ST:100, DJ:0, CK:25, CT:100, HJ:0, CQ:40, H9:100, HQ:0, CJ:0, H8:100, DK:0, C9:0, H7:100",29306,Left
"C7 C8 CT CA SJ H9 HA D9 DT DJ","HT D8",false,1,"H8:100, H9:0, H7:100",4084,Right
"C8 CK H9 HQ HK D7 D9 DT DQ DA","SK D8",false,1,"H7:100, H9:0, HA:100, C7:100, C9:98, C8:0, HJ:93, HQ:0, H8:100",9699,Right
"CT CQ CK CA SJ H9 HT HJ HQ D7","HK DQ",false,1,"D7:0, DK:100, DA:100, S7:98, SJ:0, S9:100",6310,Declarer
"C8 CT CK S7 S9 SJ H7 HQ DJ DQ","CQ SQ",false,1,"S7:0, ST:98, SA:83, C9:93, C8:0, CA:100, C7:100, CJ:95, CT:0, HT:88, H7:0, HJ:95, D7:90, DA:80, DQ:0, HK:85, HQ:0, H9:78, DT:78, DJ:0, D8:100",20379,Declarer
"CQ S9 ST H8 H9 HK HA D7 D8 DT","CT SQ",true,0,"C7:95, CK:100, CQ:3, H7:95, H8:10, HQ:98, C9:95, C8:93, ST:23, HT:95, HJ:65, H9:58, D9:45, D8:45, SA:93, DJ:30, DT:83, CA:88, SJ:33, S9:100, SK:63, S7:33, DA:80, HA:100, S8:0, DK:0, HK:100, CJ:0, DQ:0, D7:100",32934,Left
"CT S8 SQ H8 H9 HA D9 DT DK DA","C8 CJ",false,1,"H7:100, HK:98, H9:0, C9:98, CT:0, CA:98, S7:100, SA:100, SQ:0, C7:90, HA:5, CQ:100, S9:98, SK:52, S8:10, DJ:70, DT:20, DQ:100, HQ:100, HJ:20, H8:28, D7:100, CK:100, D9:0",23581,Left
"CK S7 ST SJ H7 HQ DT DJ DQ DK","C9 D7",false,1,"D8:100, HA:100, DT:0",2921,Left
"C8 CJ CA SA H7 HT HJ HK HA DQ","CK DK",false,1,"H7:0, SK:100, HQ:100, S8:100, SA:0, S7:100",5799,Declarer
"C8 C9 CT CK S7 ST SK H7 HA DA","CJ SA",false,1,"D7:100, DA:0, D8:100",3364,Right
"C8 CT CJ CA S9 SQ H9 HJ DJ DA","CQ SK",false,1,"S7:100, HA:100, S9:0",3026,Left
"C7 C9 CK ST SA H7 HA D9 DQ DK","SQ DT",false,1,"H7:0, HK:98, HJ:100, S7:100, SK:100, ST:0, D7:100, D9:0, DA:95, C8:98, CA:85, CK:0, D8:95, DQ:0, S9:100",14978,Declarer
"C9 CQ CA S9 ST SQ HT HK D7 DT","S8 HQ",false,1,"C7:95, CK:100, CQ:0, H7:100, HT:0, H8:100",7594,Left
"CT S7 SK H8 H9 HJ HK D7 D8 DA","CA S8",false,1,"C7:100, CT:0, C9:100",3320,Right
"C8 CT CQ SJ SQ SK H7 HJ HQ DJ","S9 HA",false,1,"S7:98, SA:100, SK:0, D7:100, DJ:0, D8:100",7704,Left
"CJ CQ S9 ST SK HQ HA DT DJ DK","SA D7",false,1,"H7:100, HQ:0, HK:98, D9:100, D8:100, DT:0",6383,Right
"C9 CT CJ CQ ST SQ SK H8 HJ HA","SJ HK",false,1,"H8:0, HT:100, HQ:98, C7:98, C9:0, H7:100",6905,Declarer
"CJ CQ CA ST SK HT HJ HK D9 DJ","CT DT",false,1,"H8:100, H9:100, HT:0",4903,Left
"C9 CK CA S9 SJ SK SA D9 DQ DK","D7 DT",false,1,"H7:100, SA:0, HK:100, C7:100, CQ:95, C9:0, CJ:95, CK:0, C8:100",9102,Right
"C8 CQ S7 ST SK SA HK HA D7 D9","HQ DJ",false,1,"C7:98, CA:100, CQ:0, H7:100, HK:0, HJ:100",7290,Left
"C8 C9 CQ CK S7 SJ H9 HA D9 DJ","D8 DA",false,1,"S7:0, SK:100, SA:100, C7:100, C8:0, CJ:98, H7:100, HT:100, H9:0, ST:98, SJ:0, S8:100",12498,Declarer
"C9 CT CA SK H8 H9 HJ D7 DJ DA","HK DK",false,1,"C7:100, C9:0, C8:100",2899,Right
"C7 CQ S7 S9 SK SA H7 H9 HA D9","SQ D7",false,1,"H8:98, DK:100, H7:0, HT:100, DJ:100, H9:0, HJ:100, CK:98, HA:0",10900,Left
"C8 C9 CQ ST SJ SA H7 HT DT DK","CT HA",false,1,"D9:100, DT:0, DA:100, S7:100, S9:100, ST:0",7290,Right
"C8 S8 SJ H7 H9 HT HJ HA D7 DT","S7 H8",true,0,"C8:28, CK:75, CA:98, C7:100, SJ:75, CQ:45, HQ:40, SK:95, HJ:55, ST:10, SQ:95, S8:78, D8:98, D7:70, DA:0, CT:0, CJ:60, DT:100, D9:85, HA:100, DK:0, DQ:0, DJ:30, HT:100, HK:0, C9:10, H9:100, SA:0, S9:0, H7:100",50010,Declarer
"C7 CT CJ CK S7 S9 SA H8 HK DK","SK D9",false,1,"H7:100, HA:98, HK:0, S8:100, S7:0, SJ:98, D8:100, D7:95, DK:0",12185,Left
"CT CQ S9 SA H7 HJ HA D8 DQ DA","C8 S7",false,1,"H7:0, HQ:100, HK:100, D7:100, D8:0, DT:100, H8:100, H9:100, HJ:0",10712,Declarer
"CJ S8 ST SQ SK HJ HQ HA D8 D9","HK DJ",false,1,"D7:100, D8:0, DA:100, S7:100, SA:98, SK:0, S9:95, S8:0, SJ:100, H7:98, H8:95, HJ:0",14606,Right
"C7 CT CQ SK SA H7 HT HK DT DK","HA DA",false,1,"D7:98, DQ:100, DT:0, S7:100, SK:0, S9:100",6692,Left
"C7 S7 S9 SJ HT HJ D9 DT DK DA","C9 CA",false,1,"S7:0, SA:100, SK:100, D7:98, D8:100, D9:0",7003,Declarer
"C9 CK CA S7 SJ H8 HT HK HA DQ","CT SA",false,1,"S7:0, SQ:100, SK:100, D7:98, DQ:0, DJ:100",7310,Declarer
"C8 CJ CA S8 SQ H7 HT HA D9 DQ","CT HK",false,1,"H7:0, HQ:98, HJ:100, C7:95, SA:100, C8:0",7190,Declarer
"C7 CA S7 S8 SK H8 HT D7 D8 DA","HK DQ",false,1,"H7:98, HA:100, HT:0, H9:100, H8:0, HQ:95, CJ:98, CK:95, C7:0, S9:95, S8:0, SA:98, D9:85, SQ:95, D8:0, DT:100, CQ:90, D7:0, DJ:100, SJ:88, DA:0",22410,Left
"C8 CJ S7 SQ H8 H9 HK D8 DT DJ","CA HA",true,0,"D7:100, D8:0, DA:95, H7:100, HQ:100, H9:3, C7:100, C8:3, CK:98, ST:98, SJ:98, S7:0, S8:100, SQ:3, SA:95, C9:90, CQ:95, CJ:33, DQ:75, DJ:38, DK:80, CT:60, HJ:38, DT:100, D9:0, HT:0, HK:100, SK:0, S9:0, H8:100",31606,Right
"C7 C9 CJ CK CA SJ H7 H9 D9 DA","H8 HQ",false,1,"H7:0, HA:100, HK:100, D7:95, D8:100, D9:0",7073,Declarer
"CQ CK CA S9 SJ H9 HQ DQ DK DA","S7 SQ",false,1,"H7:100, H9:0, HA:100, D7:98, D9:100, DQ:0",7205,Right
"CQ S8 SJ SA H8 H9 HA D8 D9 DT","CJ HJ",true,0,"D8:0, DA:98, DJ:100, C8:100, CA:100, CQ:0, S7:98, S8:0, SQ:95, HT:90, HK:100, H9:0, D7:93, D9:3, DK:80, C9:58, C7:98, SA:13, HQ:38, H7:8, H8:30, CT:18, SK:0, HA:100, DQ:0, ST:0, DT:100, CK:0, S9:0, SJ:100",30303,Declarer
"C7 CK S7 S9 ST SQ SA H8 HQ DT","SJ D7",true,0,"DT:3, DA:100, DK:100, CJ:95, CT:100, C7:5, D8:95, D9:95, CK:23, C8:93, HQ:100, CA:68, HA:70, HK:20, H8:100, S8:73, HJ:25, S7:100, DJ:0, HT:0, SA:100, DQ:0, C9:0, SQ:100, CQ:0, H9:0, ST:100, SK:0, H7:0, S9:100",33994,Declarer
"CJ CK S8 S9 H7 H8 HQ HK D9 DQ","C9 DT",false,1,"S7:98, S8:0, SA:98, D7:100, DA:98, DQ:0, HT:100, H8:0, HJ:98, C8:100, C7:95, CJ:0",13690,Right
"C7 C9 CT SQ H9 HT HJ D9 DT DK","CQ HQ",false,1,"S7:100, SA:100, SQ:0, SJ:95, DK:3, ST:95, D7:100, D9:0, DA:98, C8:98, CA:93, CT:5, D8:90, DT:18, S8:100",17016,Left
"C7 CJ CQ CK S8 SJ SQ SK HQ DT","HT HA",false,1,"S7:98, S8:0, ST:100, C8:100, CT:98, C7:0, H8:100, HQ:0, H7:100",9880,Right
"CT S9 SJ H9 HT HA D8 D9 DQ DK","SQ SA",false,1,"D8:0, DA:100, DJ:100, D7:100, SK:100, D9:0",6830,Declarer
"C7 C8 C9 CJ CQ SK SA HT HK D9","H7 D8",false,1,"D7:100, D9:0, DK:100, H8:100, HA:93, HK:0, S7:98, SK:0, ST:100",9591,Right
"CT CJ CA S9 SA H7 HK HA D8 DT","H8 D9",false,1,"H7:0, HT:100, HQ:100, D7:100, D8:0, DQ:100, S7:100, SQ:100, S9:0, DK:98, DT:0, DJ:98, C8:95, CT:0, C7:100",17206,Declarer
"CT CK CA S9 SK H7 H9 HQ D7 DA","HJ D8",false,1,"S8:100, S9:0, S7:100",3077,Right
"C9 CT SK SA H7 H8 HT HQ HA DJ","HK DQ",false,1,"H7:0, HJ:100, CA:100, H9:98, CK:100, H8:0, S8:80, SQ:100, SK:0",10612,Declarer
"C8 C9 CT CA S8 H7 H8 HA D8 D9","D7 DJ",false,1,"H9:100, HK:98, H8:3, C7:100, C8:10, S7:100",9194,Left
"C8 C9 S7 ST SJ SA HT HQ HA DK","CA H8",false,1,"H7:100, HJ:100, HT:0, S8:98, S7:0, SQ:95, C7:98, DA:100, C8:0",9512,Left
"C8 C9 S7 SQ SK SA H9 HK D7 D9","H8 DT",false,1,"D7:0, DA:100, D8:95, C7:100, CA:98, C9:0, S9:100, S7:0, S8:93, HA:98, HK:3, HQ:98, ST:95, SQ:0, H7:100",15591,Declarer
"C8 CK S8 ST H8 HQ HK D8 DJ DK","C9 DA",false,1,"D8:0, D9:98, DQ:100, DT:98, DJ:0, D7:100",6884,Declarer
"CT CK CA S8 SQ SA H9 HK HA DJ","HT HQ",false,1,"S8:0, SJ:98, SK:100, D7:100, DJ:0, DQ:100, C7:93, CQ:98, CT:0, H7:98, H9:0, HJ:95, ST:95, S9:93, SQ:0",14718,Declarer
"ST SQ SK H8 H9 HT HJ HQ HA DA","S8 D9",false,1,"S7:100, ST:0, H7:100",3489,Right
"C7 CJ CQ S8 SQ H9 HK D9 DJ DA","C8 CK",false,1,"D7:100, D9:0, DK:100, S7:98, S9:100, S8:0, DT:100, DJ:0, D8:100",9806,Right
"C8 CJ CK S7 SJ HA D8 DJ DQ DA","S8 DK",false,1,"H8:100, HA:0, H7:100",3996,Right
